paragraph,gen_summary
"□ 개정안은 구분소유자의 2분의 1 이상의 찬성이 있는 경우 관리인은 「주식회사의 외부감사에 관한 법률」 제3조에 따른 감사인의 회계감사를 연 1회 이상 받고 그 결과를 구분소유자에게 보고하도록 하는 내용임.
□ 개정안은 집합건물 회계운영의 투명성을 제고하고, 구분소유자의 관리인에 대한 통제수단을 확보하려는 것으로 그 취지는 타당하다고 보임. 
 - 2015년 1월 1일부터 시행되는 「주택법」 제45조의3에 따르면 300세대 이상인 공동주택의 관리주체는 회계감사를 매년 1회 이상 의무적으로, 300세대 미만인 공동주택의 관리주체는 입주자 및 입주자대표회의가 요구하는 경우 회계감사를 받도록 규정하고 있음. 
□ 다만, 현행법에 따르더라도 언제든지 제31조에 따른 관리단집회의 결의(구분소유자 및 의결권의 과반수)를 통해 회계감사를 받을 수 있으므로 의결 요건이 동일한바 개정의 실익이 없으며, 
 - 집합건물은 종류, 형태 및 규모가 매우 다양하므로 개별 집합건물의 실정을 고려하여 규약으로 정하는 방안을 고려할 필요가 있다는 지적이 있음. 
□ 「주택법」의 규정과 달리 집합건물의 관리인 대해서 구분소유자 2분의 1 이상의 요구로 회계감사 및 보고 의무를 명시할 것인지는 위와 같은 제반사정을 고려하여 입법정책적으로 결정할 사안으로 보임.","개정안은 구분소유자의 절반 이상의 찬성이 있는 경우 관리인은 「주식회사의 외부감사에 관한 법률」에 따른 감사인의 회계감사를 연 1회 이상 받고 그 결과를 구분소유자에게 알리게 하는 것으로, 이는 집합건물 회계운영의 투명성을 높이고, 구분소유자의 관리인에 대한 통제수단을 확보하려는 것으로 바람직한 취지임.
다만, 현행법에 따르더라도 언제든지 제31조에 따른 관리단집회의 결의를 통해 회계감사를 받을 수 있어 의결 요건이 동일한바 개정의 실익이 없고, 집합건물은 종류, 형태 및 규모가 다양하므로 개별 집합건물의 실정을 감안해 규약으로 정하는 방안을 고려해야 한다는 지적이 있음.
「주택법」의 규정과 달리 집합건물의 관리인 대해서 구분소유자 절반 이상의 요구로 회계감사 및 보고 의무를 명시할 것인지는 위와 같은 제반사정을 고려하여 결정해야 함."
"개정안은 한국은행의 허가 없이 주화를 훼손한 자에 대한 법정형을 현행 ‘6개월 이하의 징역 또는 500만원 이하의 벌금’에서 ‘1년 이하의 징역 또는 1천만원 이하의 벌금’으로 강화하려는 것임(안 105조의2).
현행 「한국은행법」 제53조의2는 한국은행의 허가 없이 영리를 목적으로 주화를 다른 용도로 사용하기 위하여 융해·분쇄·압착, 그 밖의 방법으로 훼손하여서는 아니됨을 규정하고 있고, 제105조의2는 이를 위반하여 주화를 훼손한 자에게 ‘6개월 이하의 징역 또는 500만원 이하의 벌금’에 처하도록 규정하고 있음. 
개정안은 현행법률 전반에 걸쳐 행정형벌 조항의 문제점과 개선방안을 마련하기 위해 2013년 3월 14일에 구성된 「국회의장 직속 법정형정비자문위원회」의 성과를 입법으로 조치하려는 것으로, 법정형정비자문위원회의 논의 배경은 아래와 같음. 
주화훼손으로 인한 통화시장의 교란을 방지하려는 공익적 입법취지에 비추어, 현행 ‘6개월 이하의 징역 또는 500만원 이하의 벌금’은 제재를 통하여 주화훼손 방지를 담보하려는 취지가 반감되고 있으며, 법정형 자체도 유사한 유형의 의무 위반에 대한 형량을 고려할 때 낮은 수준임. 
따라서, 한국은행의 허가 없이 주화를 훼손한 자에 대한 법정형을 강화하려는 개정안은 바람직한 입법 조치로 생각됨.","개정안은 한국은행의 허가 없이 주화를 훼손한 자에 대한 법정형을 현행 ‘6개월 이하의 징역 또는 500만원 이하의 벌금’에서 ‘1년 이하의 징역 또는 1천만원 이하의 벌금’으로 강화하려는 것으로, 주화훼손으로 인한 통화시장의 교란을 방지하려는 공익적 입법취지에 비추어, 현행 ‘6개월 이하의 징역 또는 500만원 이하의 벌금’은 제재를 통하여 주화훼손 방지를 담보하려는 취지가 반감되고 있으며, 법정형 자체도 유사한 유형의 의무 위반에 대한 형량을 고려할 때 낮은 수준으로, 한국은행의 허가 없이 주화를 훼손한 자에 대한 법정형을 강화하려는 개정안은 바람직함."
"□ 개정안은 전기통신수단을 이용하여 행해지는 여러 사기행위 중에서도 미성년자인 직계비속의 안전과 관련된 허위사실의 고지가 있는 경우를 특별히 중하게 처벌하려고 하고 있는데,
   이는 어린 자녀의 안전에 관한 부모의 염려를 이용하는 것이 다른 경우보다 반인륜적이어서 행위의 불법성과 행위자의 책임이 더 크다고 판단함에 따른 것임.
   최근 아동ㆍ청소년을 대상으로 하는 범죄의 범람으로 인하여 어린 자녀의 안전에 관한 부모의 불안감이 고조되고 있으며, 이를 이용하여 재산적 이익을 취하는 행위의 비윤리성이 결코 가볍지 않다는 점에서 개정안의 취지는 공감할 수 있음.
□ 그러나 개정안에 대하여는 다음의 사항을 고려하여 신중하게 검토하는 것이 타당할 것으로 생각됨.
○ 첫째, 안 제347조의3은 미성년자인 직계비속의 안전에 관련된 허위사실을 고지하는 경우만을 가중하여 처벌하도록 규정하고 있으므로, 이는 허위사실의 내용에 따른 차별취급에 해당함.
   그러나 허위사실의 대상이 미성년자인 직계비속인지 아니면 성년자인 직계비속인지 등에 따라 가족의 안전에 대한 피해자의 염려를 이용하여 재산적 이익을 취하는 행위의 불법성이 달라진다고 할 수 있을지 또한 의문이므로, 이러한 가중처벌을 합리적 이유가 있는 차별이라 하기는 어려울 것으로 보임.
○ 둘째, 안 제347조의3은 허위사실의 고지 방법으로 전기통신을 이용한 경우만을 가중처벌의 대상으로 삼고 있으므로, 이는 허위사실의 고지 방법에 따른 차별취급에 해당함.
   그러나 전기통신의 방법으로 허위사실을 고지한 경우가 전기통신 외의 방법으로 같은 내용을 고지한 경우보다 불법성이 중하다고 할 수 있을지 의문이므로, 이에 근거한 가중처벌을 합리적 이유가 있는 차별이라 할 수 있는지에 대하여 논의할 필요가 있음.
○ 셋째, 안 제347조의3은 조문의 위치ㆍ내용에 비추어, 전기통신을 이용한 피싱류의 사기행위를 규율하는 규정인데, 피싱범행에는 구체적 사안에 따라 공갈죄 등도 적용되므로, 개정안은 유사한 행위 간에 형의 불균형을 야기할 수 있음.
   미성년자인 직계비속의 안전에 관한 허위사실의 고지는 구체적 사안에 따라 사기 또는 공갈행위로 판단될 것인데, 개정안에 따르면 사기행위로 판단될 경우는 안 제347조의3에 의해 1년 이상의 유기징역으로 처벌되나, 공갈행위로 판단될 경우에는 제350조나 「통신피해방지특별법」 제15조의2에 따라 10년 이하의 징역 등으로 처벌되므로, 유사한 행위에 있어 심각한 형의 불균형이 발생할 수 있음.
○ 한편, 안 제347조의3의 ‘안전에 관한 허위사실’이란 표현은 그 범위가 명확하지 않으며, 같은 조가 법정형으로 1년 이상의 유기징역형(최장 30년, 가중 시 50년까지 가능)을 규정하고 있는 것은 단순한 허위사실의 고지에 대한 지나친 형벌로 과잉금지 원칙에 반할 우려가 있다는 지적도 있음.","개정안은 전기통신수단을 이용하여 행해지는 여러 사기행위 중에서도 미성년자인 직계비속의 안전과 관련된 허위사실의 고지가 있는 경우를 특별히 중하게 처벌하려고 하고 있는데, 이는 어린 자녀의 안전에 관한 부모의 염려를 이용하는 것이 다른 경우보다 반인륜적이어서 행위의 불법성과 행위자의 책임이 더 크다고 판단함에 따른 것임.
그러나 개정안에 대하여는 다음의 사항을 고려하여 신중하게 검토하는 것이 타당할 것으로 생각됨.
첫째, 안 제347조의3은 미성년자인 직계비속의 안전에 관련된 허위사실을 고지하는 경우만을 가중하여 처벌하도록 규정하고 있으므로, 이는 허위사실의 내용에 따른 차별취급에 해당함.
둘째, 안 제347조의3은 허위사실의 고지 방법으로 전기통신을 이용한 경우만을 가중처벌의 대상으로 삼고 있으므로, 이는 허위사실의 고지 방법에 따른 차별취급에 해당함.
셋째, 안 제347조의3은 조문의 위치ㆍ내용에 비추어, 전기통신을 이용한 피싱류의 사기행위를 규율하는 규정인데, 피싱범행에는 구체적 사안에 따라 공갈죄 등도 적용되므로, 개정안은 유사한 행위 간에 형의 불균형을 야기할 수 있음.
한편, 안 제347조의3의 ‘안전에 관한 허위사실’이란 표현은 그 범위가 명확하지 않으며, 같은 조가 법정형으로 1년 이상의 유기징역형을 규정하고 있는 것은 단순한 허위사실의 고지에 대한 지나친 형벌로 과잉금지 원칙에 반할 우려가 있다는 지적도 있음."
"□ 개정안은 기업도시 개발사업을 활성화하기 위하여 기업도시개발구역에 입주하는 기업이 수입하는 자본재와 기업도시개발구역에 입주하는 외국인투자기업 및 기업도시개발사업 시행자로 지정된 외국인투자기업이 「외국인투자 촉진법」에 따라 도입하는 자본재에 대하여 관세를 면제하는 내용임.
□ 기업도시 개발사업은 민간기업이 낙후지역에 산업입지와 경제활동기반을 갖춘 도시를 개발‧운영하도록 함으로써 민간투자를 촉진하고 국가균형발전을 도모하기 위하여 「기업도시개발 특별법」에 따라 추진되고 있으며, 2014년 12월 기준으로 4개 기업도시가 개발되고 있음. 
□ 개정안에 대해서는 현재도 기업도시 입주기업 및 기업도시 개발사업 시행자에 대해서는 다양한 국세 및 지방세 감면이 이루어지고 있으므로 추가적인 조세지원은 불필요하고, 지난해 1조 8,000억원에 이르는 세수결손이 발생하는 등 관세 세입여건이 좋지 않은 점 등을 감안할 때 관세감면 제도의 신규 도입은 신중을 기해야 한다는 의견이 있음.
□ 그러나, 현실적으로 기업도시는 민간기업의 국내 투자촉진을 통해 국가균형발전을 도모하기 위하여 도입되었으나, 기업도시 입주기업 및 개발사업자가 입지규제, 개발이익 환수, 토지직접사용 의무 등 많은 제약을 받음에 따라 당초 취지와 달리 사업이 활성화되지 못하고 있으므로, 기업도시에 대한 추가적인 지원 방안을 강구할 필요가 있고 특히, 기업도시는 국가균형발전을 위하여 낙후지역을 중심으로 지정되어 다른 개발특구에 비해 사회 기반시설이 열악하다는 점도 고려할 필요가 있음.
   또한, 경제자유구역, 새만금사업지역 및 제주투자지구 등 기업도시와 유사한 개발특구의 경우 외국인투자기업 및 외국인 개발사업시행자가 도입하는 자본재에 대한 관세가 면제되고 있다는 점도 감안할 필요가 있음.","개정안은 기업도시 개발사업을 활성화하기 위하여 기업도시개발구역에 입주하는 기업이 수입하는 자본재와 기업도시개발구역에 입주하는 외국인투자기업 및 기업도시개발사업 시행자로 지정된 외국인투자기업이 외국인투자 촉진법에 따라 도입하는 자본재에 대하여 관세를 면제하는 내용인데, 이에 대해서는 현재도 기업도시 입주기업 및 기업도시 개발사업 시행자에 대해서는 다양한 국세 및 지방세 감면이 이루어지고 있으므로 추가적인 조세지원은 불필요하고, 관세 세입여건이 좋지 않은 점 등을 감안할 때 관세감면 제도의 신규 도입은 신중을 기해야 한다는 의견이 있음.
하지만 현실적으로 기업도시 입주기업 및 개발사업자가 많은 제약을 받음에 따라 당초 취지와 달리 사업이 활성화되지 못하고 있으므로 추가적인 지원 방안을 강구할 필요가 있고, 특히 기업도시는 국가균형발전을 위하여 낙후지역을 중심으로 지정되어 다른 개발특구에 비해 사회 기반시설이 열악하다는 점도 고려할 필요가 있음.
또한 기업도시와 유사한 개발특구의 경우 외국인투자기업 및 외국인 개발사업시행자가 도입하는 자본재에 대한 관세가 면제되고 있다는 점도 감안할 필요가 있음."
"개정안의 취지는 가계부채의 차주 별 상환능력을 분석하기 위하여 금융자산, 금융소득 및 신용정보와 실물자산, 근로소득 등 각종 소득 정보를 한국은행 또는 통계청에 집중하고자 하는 것임.
 그동안 가계부채에 관한 한국은행의 통계가 거시적인 부채총량에 관한 통계 위주였고, 미시적 통계인 통계청의 가계금융복지조사는 설문조사 방법상 한계로 정확성이 부족하며, 연 1회 조사이기 때문에 지금처럼 가계부채가 짧은 기간에 급증하는 경우에 통계분석 수요를 충족하기 어려운 점이 있음.    
한국은행 또는 통계청이 차주의 식별정보가 포함된 자산, 소득, 부채에 관한 정보를 취득하면 개인별 자산․소득과 부채를 결합시켜 부채상환능력을 분석하고자 하는 목적은 확실하게 달성될 수 있겠으나, 아직까지 개인별 자산, 소득, 부채에 관한 정보를 한 기관에 집중한 예가 없어 개인정보 보호 관점에서 문제가 제기될 수 있고, 각 개인정보의 결합으로 다양한 정보가 생산될 수 있어 정보 유출 사고 발생시 사생활 침해의 범위나 위험성이 훨씬 커질 수 있는 우려가 있다고 봄. 
따라서, 개정안에 대하여는 가계부채의 상환능력 분석을 통한 가계부채 대책마련과 개인정보 보호의 필요성 사이에서 정책적 판단이 필요한 부분임.    
개인정보 침해 위험성에 관하여 한국은행과 통계청은, 집중된 정보의 외부유출 리스크와 내부 남용 리스크 등을 최소화하는 방향으로 DB시스템을 구축하고, 정보수집단계에서도 고유식별정보를 삭제하고 개인별 암호코드를 부여하여 정보제공기관으로부터 관련 정보를 입수하거나정보를 통합한 이후 고유식별정보를 삭제하는 등 개인정보 침해가 최소화되도록 보완방안을 마련하겠다는 의견을 제시하고 있음.","개정안은 차주별 가계부채 상환능력을 분석하기 위하여 각종 자산, 신용정보와 소득 정보를 한국은행 또는 통계청에 집중하려는 내용임.
그동안 가계부채에 관한 한국은행의 통계는 거시적인 부채총량에 관한 통계 위주였고, 통계청의 가계금융복지조사는 정확성이 부족하며, 연 1회 조사이기 때문에 지금처럼 가계부채가 짧은 기간에 급증하는 시기에 통계분석 수요를 따라가기 어려움.
개정안에 따르면 한국은행 또는 통계청이 개인별 자산․소득과 부채를 결합해 부채상환 능력을 분석하고자 하는 목적은 확실하게 달성될 수 있겠으나, 지금까지 개인별 자산, 소득, 부채에 관한 정보를 한 기관에 집중한 예가 없어 개인정보 보호 관련 문제가 제기될 수 있고, 각 개인정보의 결합으로 다양한 정보가 생산될 수 있어 정보 유출 사고 발생 시 사생활 침해의 범위나 위험성이 훨씬 커질 수 있음.
따라서, 가계부채의 상환능력 분석을 통한 가계부채 대책 마련과 개인정보 보호의 필요성 사이에서 정책적 판단이 필요함.
한국은행과 통계청은, 집중된 정보의 유출과 내부 남용 리스크 등을 최소화하도록 DB시스템을 구축하고, 정보수집단계에서도 고유식별정보를 삭제하고 개인별 암호코드를 부여하여 관련 정보를 입수하는 등 보완방안을 마련하겠다는 의견임."
"개정안은 근로소득자가 이용하는 전기통신서비스 요금 지급액에 대한 특별세액공제를 신설하려는 것임.
  미래창조과학부에 따르면, 2014년 9월 말 현재 시내전화 가입자 수는 1,713만 2,988명, 초고속인터넷은 1,911만 6,453명, 인터넷전화 1,244만 7,793명, 이동전화 5,674만 5,776명 가입한 것으로 나타나 방송통신 서비스는 일상생활에서 필수재적인 성격이 있다고 볼 수 있음.
  특히 최근 스마트폰 보급의 확산과 함께 이동통신에 대한 활용도가 높아지면서 통신비 지출이 점차 증가하고 있음. 2014년 2/4 분기 현재 근로자 가구의 통신비는 월 15만 270원으로 전체 소비지출(265만 1,575원)의 5.7%를 점유하고 있어 가계운영에 상당한 부담이 되는 실정임.
  개정안에 따르면, 4인 가구 기준으로 최대 20만원의 세부담 경과 효과가 있으며, 5인 이상 가구의 경우 4인 초과 1인당 5만원씩 추가로 세부담이 경감될 수 있어, 최근 실질임금 정체, 주거비용 상승, 가계부채 증가 등으로 어려움을 겪고 있는 근로소득자에게 일부 도움이 될 것으로 예상됨.
  다만, 개정안에 대하여 다음 사항을 감안할 필요가 있음.
  첫째, 우리나라는 개산 공제제도인 근로소득공제 제도를 도입하고 있어 통신비 지출과 같은 일상적인 지출항목은 근로소득공제에 포함된다고 볼 수 있으며, 통신비에 대한 세액공제 적용시 전기료, 수도료, 교통비 등 기타의 지출항목에 대해서까지 세액공제 요구를 유발하게 되어 정상적인 세제 운영이 곤란해 질 수 있음.
  둘째, 국회예산정책처에 따르면, 개정안과 같은 방식으로 통신비 세액공제 제도를 도입할 경우 5년간 8조 6,115억원(연평균 1조 7,223억원)의 막대한 세수감소가 예상되는 바 소득세 과세기반의 잠식이 우려되며, 최근의 비과세․감면 축소 기조에 부합하지 않는 측면이 있다고 보임.","개정안은 근로소득자가 이용하는 전기통신서비스 요금 지급액에 대한 특별세액공제를 신설하려는 것으로, 최근 스마트폰 보급의 확산과 함께 이동통신에 대한 활용도가 높아지면서 통신비 지출이 점차 증가하고 있음. 개정안에 따르면, 4인 가구 기준으로 최대 20만원의 세부담 경과 효과가 있으며, 5인 이상 가구의 경우 4인 초과 1인당 5만원씩 추가로 세부담이 경감될 수 있어, 최근 실질임금 정체, 주거비용 상승, 가계부채 증가 등으로 어려움을 겪고 있는 근로소득자에게 일부 도움이 될 것으로 예상되지만, 개정안에 대하여 다음 사항을 감안할 필요가 있음. 첫째, 우리나라는 개산 공제제도인 근로소득공제 제도를 도입하고 있어 통신비 지출과 같은 일상적인 지출항목은 근로소득공제에 포함된다고 볼 수 있으며, 통신비에 대한 세액공제 적용시 전기료, 수도료, 교통비 등 기타의 지출항목에 대해서까지 세액공제 요구를 유발하게 되어 정상적인 세제 운영이 곤란해 질 수 있음. 둘째, 국회예산정책처에 따르면, 개정안과 같은 방식으로 통신비 세액공제 제도를 도입할 경우 5년간 8조 6,115억원의 막대한 세수감소가 예상되는 바 소득세 과세기반의 잠식이 우려되며, 최근의 비과세․감면 축소 기조에 부합하지 않는 측면이 있다고 보임."
"가. 취업지원대상자 인원 및 취업지원 횟수의 제한(안 제19조)
  안 제19조(취업지원 대상자 등)는 보훈보상체계개편(2012. 7. 1)에 따른 「국가유공자법」개정규정에 맞추어 특수임무유공자의 자녀 중 1명에 대해서만 취업지원을 실시(제2항)하도록 하고 취업지원 대상자의 취업지원 횟수를 대통령령으로 정하는 횟수 이내로 제한(제3항)함으로써 기업 등의 고용부담을 완화하고 취업지원 대상자의 성실근무를 유도하려는 것으로 필요한 것으로 보임.
나. 기능직공무원의 일반직공무원으로의 통합에 따른 명칭 변경 등(안 제21조 및 안제 21조의2)
  안 제21조(국가기관등의 채용 의무), 안 제21조의2(국가기관등에 대한 채용실태 확인), 안 제31조(국가기관 등의 통보)는 현행 국가유공자법의 체계에 맞게 정비하면서 공무원의 구분 체계에서 기능직공무원을 폐지하고 일반직공무원에 통합하는 것으로 「국가공무원법」이 개정됨에 따라 국가기관 등에서 특수임무유공자 등을 채용하는 공무원의 구분을 기능직공무원에서 일반직공무원으로 변경하는 내용으로, 보훈 관련 법령의 일관성과 법체계의 통일성을 기한다는 측면에서 타당하다고 봄.
다. 「국가유공자 등 예우 및 지원에 관한 법률」의 체계에 맞게 정비하는 조문
  안 제18조(취업지원), 안 제20조(취업지원 실시기관), 안 제20조의2(취업지원의 신청), 안 제21조의3(기업체 등의 우선 고용의무 등), 안 제21조의4(경력기간의 합산), 안 제22조(보훈특별고용), 안 제24조(채용시험의 가점), 안 제24조의2(채용 또는 고용 인원의 산정), 안 제25조(취업지원 제한) 등은 현행 「국가유공자 등 예우 및 지원에 관한 법률」의 체계에 맞게 정비하는 내용으로 보훈 관련 법령의 일관성과 법체계의 통일성을 기한다는 측면에서 타당한 것으로 보임.","첫째, 개정안은 국가유공자법 개정규정에 맞추어 특수임무유공자의 자녀 중 1명에 대해서만 취업지원을 실시하도록 하고 취업지원 대상자의 취업지원 횟수를 대통령령으로 정하는 횟수 이내로 제한함으로써 기업 등의 고용부담을 완화하고 취업지원 대상자의 성실근무를 유도하려는 것으로 필요한 것으로 보임.
둘째, 개정안은 몇몇 규정을 현행 국가유공자법의 체계에 맞게 정비하면서 공무원의 구분 체계에서 기능직공무원을 폐지하고 일반직공무원에 통합하는 것으로, 국가공무원법이 개정됨에 따라 국가기관 등에서 특수임무유공자 등을 채용하는 공무원의 구분을 기능직공무원에서 일반직공무원으로 변경하는 내용으로, 보훈 관련 법령의 일관성과 법체계의 통일성을 기한다는 측면에서 타당함.
셋째, 개정안은 몇몇 규정을 현행 국가유공자 등 예우 및 지원에 관한 법률의 체계에 맞게 정비하는 내용으로 보훈 관련 법령의 일관성과 법체계의 통일성을 기한다는 측면에서 타당함."
