paragraph,gen_summary
"가. 발의배경 및 개정안의 내용
□ 안규백의원이 대표발의한 「국유재산특례제한법 일부개정법률안」은 같은 의원이 대표발의한 「대한민국임시정부기념관의 설치 및 운영에 관한 법률안」에 규정된 국유재산특례를 반영하기 위한 것임.
□ 「대한민국임시정부기념관의 설치 및 운영에 관한 법률안」은 대한민국임시정부기념관의 설치 및 운영에 관한 근거를 마련하기 위하여 제출된 법안으로, 동 법률안 제15조는 대한민국임시정부기념관 시설의 설치 및 운영을 위하여 필요한 경우 대한민국임시정부기념관에 국가가 「국유재산법」에도 불구하고 국유재산을 무상으로 주거나 빌려주거나 관리를 맡길 수 있도록 하고 있음. 개정안은 이와 같이 국유재산을 무상으로 대부·양여하거나 사용․수익하도록 하는 특례를 별표에 반영하는 내용임.
나. 특례 신설의 타당성
(1) 목적이 공익에 부합할 것
□ 첫 번째 요건인 「국유재산특례의 목적이 공익에 부합할 것」과 관련하여 살펴보면,
□ 개정안이 국유재산특례를 두는 목적은 대한민국임시정부기념관의 설치 및 운영을 지원함으로써, 대한민국임시정부의 법통을 계승하는 헌법전문의 정신을 공고히 하고 올바른 국가관을 정립하는데 이바지 한다는 점에서 공익에 부합한다고 볼 수 있음. 
(2) 요건의 구체성․명확성
□ 두 번째 요건인 「국유재산특례의 요건이 구체적이고 명확하게 규정되어 있을 것」과 관련하여 살펴보면,
□ 「대한민국임시정부기념관의 설치 및 운영에 관한 법률안」제15조는 대한민국임시정부기념관의 설치 및 운영을 위하여 필요한 경우에 특례를 허용할 수 있다고 규정하고 있는데, 이 규정만으로는 어느 경우에 특례를 허용할지 예측할 수 없어 국유재산특례의 목적 및 적용대상을 법률에 구체적이고 명확하게 규정하도록 한 「국유재산특례제한법」제5조에 부합한다고 보기 어려운 측면이 있음.
(3) 수단의 적절성
□ 세 번째 요건인 「국유재산특례가 예산 지원, 현물출자, 그 밖의 다른 방법보다 적절할 것」과 관련하여 살펴보면, 
□ 「대한민국임시정부기념관의 설치 및 운영에 관한 법률안」제14조제1항에 따라 대한민국임시정부기념관의 업무수행에 필요한 경비를 예산의 범위에서  보조할 수 있도록 규정하고 있어 추가적으로 국유재산특례를 인정할 경우 중복지원의 문제가 야기될 수 있음.
 
(4) 존속기간의 적절성
□ 네 번째 요건인 「국유재산특례의 존속기간이 그 목적에 비추어 적절할 것」과 관련하여 살펴보면, 
□ 「대한민국임시정부기념관의 설치 및 운영에 관한 법률안」은 특례의 존속기간에 대한 규정이 없어 「국유재산특례제한법」제5조의2에 부합한다고 보기 어려운 측면이 있음.
다. 종합 검토 의견
□ 「국유재산특례제한법」제5조 및 제5조의2에서 정하고 있는 기준에 따라 특례 신설의 타당성 여부를 검토한 결과, 특례 요건이 불명확하고, 정부보조 등과 중복지원의 문제가 우려되며, 특례의 존속기간에 대한 규정이 없어 존속기간이 목적에 비추어 적절한지 여부를 판단하기 곤란하므로, 개정안대로 국유재산특례를 인정할 것인지에 대해서는 보다 신중한 검토가 있어야 할 것으로 생각됨.
□ 한편, 개정안은 안규백의원이 대표발의한 「대한민국임시정부기념관의 설치 및 운영에 관한 법률안」에 대한 소관 상임위원회(정무위원회)의 의결을 전제로 하는 것이므로, 해당 위원회의 심사과정을 감안하여 심의할 필요가 있음.","안규백의원이 대표발의한 「국유재산특례제한법 일부개정법률안」은 동 의원이 대표발의한 「대한민국임시정부기념관의 설치 및 운영에 관한 법률안」에 규정된 국유재산특례를 반영하기 위한 것으로, 「대한민국임시정부기념관의 설치 및 운영에 관한 법률안」은 대한민국임시정부기념관의 설치 및 운영에 관한 근거를 마련하기 위하여 제출된 법안으로, 국유재산을 무상으로 대부·양여하거나 사용․수익하도록 하는 특례를 별표에 반영하는 내용임.
개정안이 국유재산특례를 두는 목적은 대한민국임시정부기념관의 설치 및 운영을 지원함으로써, 대한민국임시정부의 법통을 계승하는 헌법전문의 정신을 공고히 하고 올바른 국가관을 정립하는데 이바지 한다는 점에서 공익에 부합한다고 볼 수 있지만, 개정안은 대한민국임시정부기념관의 설치 및 운영을 위하여 필요한 경우에 특례를 허용할 수 있다고 규정하고 있는데, 이 규정만으로는 어느 경우에 특례를 허용할지 예측할 수 없어 국유재산특례의 목적 및 적용대상을 법률에 구체적이고 명확하게 규정하도록 한 「국유재산특례제한법」제5조에 부합한다고 보기 어려운 측면이 있고, 개정안에 따라 대한민국임시정부기념관의 업무수행에 필요한 경비를 예산의 범위에서 보조할 수 있도록 규정하고 있어 추가적으로 국유재산특례를 인정할 경우 중복지원의 문제가 야기될 수 있으며, 특례의 존속기간에 대한 규정이 없어 「국유재산특례제한법」제5조의2에 부합한다고 보기 어려운 측면이 있음.
「국유재산특례제한법」이 정하고 있는 기준에 따라 특례 신설의 타당성 여부를 검토한 결과, 특례 요건이 불명확하고, 정부보조 등과 중복지원의 문제가 우려되며, 특례의 존속기간에 대한 규정이 없어 존속기간이 목적에 비추어 적절한지 여부를 판단하기 곤란하므로, 개정안대로 국유재산특례를 인정할 것인지에 대해서는 보다 신중한 검토가 있어야 할 것으로 생각되며, 개정안은 안규백의원이 대표발의한 「대한민국임시정부기념관의 설치 및 운영에 관한 법률안」에 대한 소관 상임위원회(정무위원회)의 의결을 전제로 하는 것이므로, 해당 위원회의 심사과정을 감안하여 심의할 필요가 있다고 보임."
"□ 현행법은 부당한 염가매각을 방지함과 동시에 입찰신고를 하려는 사람에게 기준을 제시함으로써 입찰의 공정을 이루기 위해 최저매각가격제도를 도입하고 있음.
   최저매각가격은 경매의 실시여부, 새매각, 재매각 등 경매절차에서의 기준이 되는 금액으로서 목적물에 대한 평가액을 참작하여 법원이 재량으로 결정할 수 있음. 
   그런데 현행 집행실무에서는 일반적으로 부동산 감정평가액이 최저매각가격으로 정해지고 있으며, 최저매각가격 이상의 매수신청이 없어 경매가 유찰되는 사례가 빈번히 발생하고 있음. 
   이에 따라 개정안은 최저매각가격 이상의 매수신청을 유도하기 위하여 ‘기존의 최저매각가격’을 ‘매각기준가격’으로, ‘매각기준가격에서 20% 감액한 가액’을 ‘최저매각가격’으로 2분화하여 현행법상의 최저매각가격을 하향 조정하려는 것임.
□ 최저매각가격 이상의 매수신청이 부족하여 유찰이 발생하는 문제를 해결하기 위해서는 최저매각가격이 적절히 하향될 필요성이 있으므로 이를 입법적으로 해결하려는 개정안의 취지는 타당한 측면이 있음.
   다만, 매각기준가격과 최저매각가격으로 이원화하는 제도에 대하여 다음과 같이 반대하는 의견도 제기됨.
   첫째, 현행 규정에서도 최저매각가격을 정함에 있어 법원에게 재량을 부여하고 있으므로 굳이 이원화된 가격제도를 도입할 필요성이 있는지 의문임.
   둘째, ‘현행법의 최저매각가격’을 ‘매각기준가격’이라는 개념으로 대체하면서 새로이 ‘매각기준가격’으로부터 20% 저감된 금액을 ‘최저매각가격’이라고 할 경우 ‘현행법상의 최저매각가격’을 기준으로 하고 있는 다른 규정(예 :「민사집행법」제102조)이 적용되는 사안에서 부작용이 발생할 우려가 있음.
   즉, 법원이 정한 최저매각가격으로 압류채권자의 채권에 우선하는 부동산의 모든 부담과 절차비용을 변제하면 남는 것이 없다고 인정될 경우 매각절차가 취소될 수 있는데, 개정안에 의하면 현행보다  20% 가격이 낮아지게 되므로 남을 것이 없어질 가능성이 더욱 높아지고 무잉여로 인한 경매 취소가 증가될 수 있음.
   따라서 개정안의 타당성 여부는 무잉여로 인한 경매취소 증가 등  의 부작용 발생 여부, 경매실무를 개선하기 위한 법제도적 장치를 마련한다는 측면에서의 개정실익 등을 종합적으로 검토하여 판단할 필요가 있음.","개정안은 최저매각가격 이상의 매수신청을 유도하기 위하여 ‘매각기준가격’ 및 ‘최저매각가격’으로 2분화하여 현행법상의 최저매각가격을 하향 조정하려는 것인데, 최저매각가격 이상의 매수신청이 부족하여 유찰이 발생하는 문제를 해결하기 위해서는 최저매각가격이 적절히 하향될 필요성이 있으므로 이를 입법적으로 해결하려는 취지는 타당함.
다만 현행 규정에서도 최저매각가격을 정함에 있어 법원에게 재량을 부여하고 있으므로 굳이 이원화된 가격제도를 도입할 필요성이 있는지 의문이라는 점, ‘현행법의 최저매각가격’을 ‘매각기준가격’이라는 개념으로 대체하면서 새로이 ‘매각기준가격’으로부터 20% 저감된 금액을 ‘최저매각가격’이라고 할 경우 ‘현행법상의 최저매각가격’을 기준으로 하고 있는 다른 규정이 적용되는 사안에서 부작용이 발생할 우려가 있다는 점을 들며 이에 반대하는 의견도 있음.
즉 법원이 정한 최저매각가격으로 압류채권자의 채권에 우선하는 부동산의 모든 부담과 절차비용을 변제하면 남는 것이 없다고 인정될 경우 매각절차가 취소될 수 있는데, 개정안에 의하면 현행보다 20% 가격이 낮아지게 되므로 남을 것이 없어질 가능성이 더욱 높아지고 무잉여로 인한 경매 취소가 증가될 수 있으므로, 그 타당성 여부는 부작용 발생 여부나 개정실익 등을 종합적으로 검토하여 판단할 필요가 있음."
"□ 개정안은 사면심사위원회가 뇌물, 횡령, 배임 범죄를 저지른 사람에 대하여는 특별사면을 할 수 없도록 제한하려는 것임.
□ 이는 뇌물수수, 횡령, 배임 등의 범죄를 저지른 자에 대한 특별사면이 자의적으로 행사되는 것을 방지하려는 취지라는 점에서 그 입법취지는 타당하다고 보임.
□ 이에 대하여 사면금지 대상 범죄를 특정하는 것은 시기상조인 측면이 있으므로 사면의 절차적 투명성을 제고해야 한다는 의견이 있으며,
 - 법무부도 특정 범죄에 대하여 특별사면을 제한하는 것은 특정인의 개별 사정에 대한 구체적 타당성을 고려할 수 없게 되어 사면제도의 취지에 반할 소지가 있다는 입장임.
□ 그러나 최근까지도 정치인들이나 재벌 총수 위주의 특별사면이 반복됨에 따라 사면의 공정성․적정성에 대하여 의문을 제기하는 국민의 여론이 다수 형성되어 있고, 사면의 절차적 제한만으로는 사면권의 남용을 방지하기에 충분하지 않은 것으로 평가하는 의견도 상당한 바,
 - 국민의 법감정을 고려할 때, 특정한 범죄에 대하여는 특별사면을 명시적으로 제한하는 방안도 긍정적으로 생각해볼 수 있을 것으로 판단됨.
□ 다만, 뇌물죄 등보다 형량이 중한 살인죄 등 반인륜적 강력범죄에 대하여는 사면 제한을 두지 않을 경우 형평성 문제가 제기될 우려가 있는 것으로 보이며, 사면 금지대상 범죄를 특정하는 개정안과 같은 방안 외에도 사면에 시기적 제한을 두어 일정 기간의 형 집행 후에 한하여 사면이 가능하도록 하는 방안 등 다른 대안이 존재한다는 점에서,
 - 여러 방안 중 어떤 것이 가장 합리적이고 바람직한 방안인지에 대하여는 보다 신중한 비교 검토가 필요하다고 봄.","개정안은 사면심사위원회가 뇌물, 횡령, 배임 범죄를 저지른 자는 특별사면이 불가하도록 제한하는 내용으로, 이는 뇌물수수, 횡령 등의 범죄를 저지른 자에 대한 특별사면이 자의적으로 행사되는 것을 방지하려는 취지이므로 입법이 바람직하나, 최근까지도 정치인들이나 재벌 총수 위주의 특별사면이 반복돼 사면의 공정성․적정성에 대하여 의문을 갖는 국민의 여론이 형성되어 있고, 사면의 절차적 제한만으로는 사면권의 남용을 막기에 부족하다는 의견도 많으므로, 국민의 법감정을 고려할 때, 특정한 범죄에 대해 특별사면을 명시적으로 제한하는 방안도 고려해야 함.
다만, 뇌물죄 등보다 형량이 큰 살인죄 등 반인륜적 강력범죄에 대해서는 사면 제한을 두지 않을 시 형평성 문제가 있을 수 있으며, 사면 금지대상 범죄를 특정하는 개정안과 같은 방안 외에도 사면에 시기적 제한을 두어 일정 기간의 형 집행 후에 한해 사면이 되도록 하는 방안 등의 대안이 존재한다는 점에서, 어떤 방안이 가장 합리적이고 타당한지에 대해서는 검토가 필요함."
"개정안은 “국가정보원장”을 “통일해외정보원장”으로 변경하고, 국가정보원장이 국가안전보장회의에 보고하는 국가안전보장관련 정보의 범위 중 국내 정보를 폐지하며, 수집 및 국가안전보장회의 보고 대상에 통일에 관련된 해외 및 북한 정보를 추가하고 있음.
현행법 제10조에서는 국가정보원장으로 하여금 국가안전보장에 관련된 국내외 정보를 수집․평가하여 국가안전보장회의에 보고하도록 규정하고 있음.
개정안은 국가정보원이 본래의 권한과 직무 범위를 벗어나 국내 정치에 개입하였다는 의혹이 제기되고 있으므로, 국가정보원이 국가안전보장회의에 보고하는 국가안전보장관련 정보의 범위에 국내 정보가 포함되지 않도록 함으로써 국가정보원이 국내 정치에 개입할 소지를 차단하려는 취지임.
그런데, 개정안과 같이 국가정보원장이 국가안전보장회의에 국가안전보장관련 국내정보를 보고하는 법적 근거를 폐지하더라도 국내정보 수집과 관련한 국가정보원의 직무범위를 조정하지 않는 이상, 국가안전보장회의 위원인 국가정보원장이 발언 등을 통해 국가안전보장 관련 국내 정보를 국가안전보장회의에 제공할 여지가 있음.
따라서, 국가정보원의 국내정치 개입 소지를 차단하기 위하여 국내정보 수집기능을 제한하는 입법조치가 필요하다면, 국가정보원의 직무범위에 관한 해당 법률의 개정 여부가 논의된 이후에 그 결과를 바탕으로 관련되는 다른 법률의 후속조치 여부를 논의하는 것이  타당하다고 보임.
그 밖에 개정안에서는 국가정보원장을 통일해외정보원장으로 변경하고, 국가정보원장이 국가안전보장회의에 보고하는 정보의 범위에 통일관련 정보를 추가하고 있는데, 이는 제안이유에 적시한 바와 같이 「국가정보원법」 개정을 전제한 것이므로 동 법률 개정 여부에 따라 논의할 필요가 있겠음.","개정안은 국가정보원이 본래의 권한과 직무 범위를 벗어나 국내 정치에 개입하였다는 의혹이 제기되고 있으므로, 국가정보원이 국가안전보장회의에 보고하는 국가안전보장관련 정보의 범위에 국내 정보가 포함되지 않도록 함으로써 국가정보원이 국내 정치에 개입할 소지를 차단하려는 취지임. 국가정보원의 국내정치 개입 소지를 차단하기 위하여 국내정보 수집기능을 제한하는 입법조치가 필요하다면, 국가정보원의 직무범위에 관한 해당 법률의 개정 여부가 논의된 이후에 그 결과를 바탕으로 관련되는 다른 법률의 후속조치 여부를 논의하는 것이  타당하다고 보이며, 한편, 개정안에서는 국가정보원장을 통일해외정보원장으로 변경하고, 국가정보원장이 국가안전보장회의에 보고하는 정보의 범위에 통일관련 정보를 추가하고 있는데, 이는 제안이유에 적시한 바와 같이 「국가정보원법」 개정을 전제한 것이므로 동 법률 개정 여부에 따라 논의가 필요함."
"개정안 제62조제1항은 벌금형의 경우에도 집행유예가 가능하도록 정하고 있음.
집행유예의 취지는 정상에 참작할 만한 사유가 있는 경우에 형의 집행을 유예하여 선고의 실효 또는 취소 없이 집행유예 기간이 도과한 경우에는 형 선고의 효력을 상실하도록 하여 단기자유형으로 인한 범죄 오염의 폐해를 막고 사회복귀를 용이하게 하는 형사정책적 목적에 있음.
이에 대하여 보다 중한 형벌인 징역과 금고에 대하여 집행유예를 선고할 수 있는 점을 고려하여 상대적으로 경한 형벌인 벌금형에 대해서도 마땅히 집행유예를 선고할 수 있도록 하는 것이 타당하다는 견해와 벌금형은 단기자유형의 폐해와 무관하고 벌금형에 대한 집행유예가 가능할 경우 약식명령에 대한 정식재판청구 사건의 급증 우려를 이유로 신중히 검토할 필요가 있다는 견해가 동시에 존재함.
덧붙여 벌금형의 경중을 나누어 경한 벌금형에 한하여 집행유예가 가능하도록 하는 방안도 고려할 수 있음. 일본 형법 제25조는 50만엔 이하의 벌금에 한하여 집행유예를 선고할 수 있다고 정하고 있음.",벌금형에 대해서도 집행유예를 선고할 수 있도록 하는 것이 타당하다는 견해와 약식명령에 대한 정식재판청구 사건의 급증 우려를 이유로 검토할 필요가 있다는 견해가 동시에 존재함.
"□ 현행 규정에 의하면 국회의 임명동의의 대상이 되는 공직후보자의 경우 임명을 하기 위해서는 본회의 의결을 거쳐야 하므로 위원장이 본회의에 인사청문심사경과 보고가 그 운용상 필수적인 반면, 국회의 임명동의 대상이 되지 않는 공직후보자의 경우는 선택적으로 운용되고 있음.
   개정안은 이를 시정하여 국회의 임명동의의 대상이 되지 않는 공직후보자의 경우에도 인사청문을 마친 뒤 폐회 등 부득이한 사유로 경과보고서를 이미 송부한 경우에도 경과보고를 본회의에 구두로 보고하도록 하여 의원들이 그 내용을 직접 파악할 수 있도록 하려는 것으로 이해됨.
□ 현행법에서 임명동의의 대상이 되지 않는 공직후보자에 대해서도  국회의 인사청문을 거치도록 한 취지가 대통령등이 공직후보자를   임명ㆍ지명하기 이전에 국회가 의견을 제시할 수 있도록 하여 인사권에 대한 견제 및 공직후보자의 공정한 임명을 가능하게 하려는 것이라는 점을 감안하면, 이미 인사청문경과보고서가 대통령 등에게 송부되고 공직자가 임명된 후에 인사청문경과를 국회 본회의에 보고할 실익은 크지 않을 수 있다는 점도 고려할 필요가 있을 것임.","개정안은 국회의 임명동의의 대상이 되지 않는 공직후보자도 인사청문을 마친 뒤 부득이한 사유로 경과보고서를 이미 송부한 경우에도 경과보고를 본회의에 구두로 보고하도록 해 의원들이 그 내용을 파악할 수 있도록 함.
현행법에서 임명동의의 대상이 되지 않는 공직후보자에 대해서도 국회의 인사청문을 거치도록 한 취지가 대통령등이 공직후보자를 임명ㆍ지명하기 이전에 국회가 의견을 제시할 수 있도록 하여 인사권의 견제 및 공직후보자의 임명을 공정하게 하려는 것이라는 점을 고려하면, 이미 인사청문경과보고서가 대통령 등에게 송부되고 공직자가 임명된 후에 인사청문경과를 국회 본회의에 보고할 실익은 크지 않을 수 있다는 점도 고려해야 함."
"□ 안 제122조의2 및 안 제124조의2는 수형자가 가석방 또는 석방되는 경우 재범의 위험성으로부터 사회안전을 보호하고 (가)석방된 자를 보호ㆍ감독하기 위하여,
   관할 경찰관서의 장 등에게 성명, 범죄경력 등 (가)석방된 자의 개인정보를 통보할 수 있도록 하는 근거규정을 법률에 마련하려는 것인데, 이와 관련해서는 다음과 같은 점을 유념할 필요가 있음.
   첫째, 통보되는 개인정보의 범위가 광범하므로, 개인정보 보호의 흐름에 역행할 우려가 있음.
   둘째, 안 제124조의2제1항에 따라 석방 사실을 통보하는 경우에는 이로써 확보되는 공익과 침해되는 사익을 비교형량하여 국민들에게 위험성이 높은 범죄만을 통보의 대상으로 삼아야 할 것이므로, 동 항 각 호의 죄가 이에 해당하는지에 대한 논의가 있어야 할 것임.","개정안은 수형자가 가석방 또는 석방되는 경우 재범의 위험성으로부터 사회안전을 보호하고 (가)석방된 자를 보호ㆍ감독하기 위하여, 관할 경찰관서의 장 등에게 (가)석방된 자의 개인정보를 통보할 수 있도록 하는 근거규정을 법률에 마련하려는 것임.
다만 통보되는 개인정보의 범위가 광범위하여 개인정보 보호의 흐름에 역행할 우려가 있고, 이로써 확보되는 공익과 침해되는 사익을 비교형량하여 국민들에게 위험성이 높은 범죄만을 통보의 대상으로 삼아야 할 것이라는 점을 고려하여 동 항 각 호의 죄가 이에 해당하는지에 대한 논의가 있어야 할 것임."
"개정안은 신속처리안건지정동의와 무제한토론 종결동의의 의결정족수를 현행 “재적의원 및 재적위원 5분의3 이상의 찬성”에서 “재적의원 및 재적위원 과반수의 출석과 출석의원(출석위원) 5분의 3이상의 찬성”으로 완화하려는 것임.(안 제85조의2제1항 및 제106조의2제6항).
  안건 신속처리제도와 무제한 토론제도는 제18대 국회 말에 국회법 개정(2012. 5. 25. 소위 ‘국회선진화법’)을 통해 도입된 것으로, 다수당의 일방적인 안건 처리에 따른 국회 파행을 방지하고 소수당의 의견개진기회를 보장함으로써 여·야간 대화와 합의를 통한 국회를 운영하기 위한 것임. 
  그러나 이와 같은 국회선진화법의 당초 도입취지에도 불구하고 여·야 대치시 법안 등 주요안건이 적시에 원활하게 처리되지 못하고 지연되는 문제가 발생하고 있다는 지적과 함께 안건신속처리제도와 무제한토론제도의 의결정족수를 완화하여야 한다는 주장이 일각에서 제기되고 있는 바, 개정안은 이러한 지적과 주장을 반영하려는 것으로 보임.
  따라서 개정안에서와 같이 의결정족수 완화를 위해서는 국회선진화법 시행에 따른 전반적이고 종합적인 검토·평가를 통한 여·야간 충분한 논의가 선행되어야 할 것으로 보임.","안건 신속처리제도와 무제한 토론제도는 제18대 국회 말에 국회법 개정을 통해 도입되었는데, 여·야 대치 시 주요안건이 제때 원활하게 처리되지 못하고 지연되는 문제가 발생하고 있다는 지적이 있고, 안건신속처리제도와 무제한토론제도의 의결정족수를 완화하여야 한다는 주장도 나오고 있는 바, 개정안은 이를 반영하여 신속처리안건지정동의와 무제한토론 종결동의의 의결정족수를 “재적의원 및 재적위원 과반수의 출석과 출석의원(출석위원) 5분의 3이상의 찬성”으로 완화하려는 것으로, 이러한 의결정족수 완화를 위해서는 국회선진화법 시행에 따른 검토·평가를 통한 여·야간 논의가 선행될 필요가 있다고 보임."
