paragraph,gen_summary
"법률안 제1조의 목적은 부당한 범죄수익의 환수를 통하여 특정재산범죄의 감소를 꾀하고 헌법적 정의를 실현하려는 것으로 경제성장에도 불구하고 정의에 어긋나는 방법으로 경제 질서를 어지럽히는 사례가 여전히 반복되는 사례가 있어 이에 대한 반성적 고려에 의한 입법으로 보임. 다만, 타 몰수 특례법과 목적과 대상이 중복되는 점이 있음.
법률안 제2조제1호는 특정재산범죄로 취득 재물 50억원 이상의 (업무상)횡령죄와 배임죄를 정하고 있는데, 해당 죄에 대해서는 「범죄수익은닉의 규제 및 처벌 등에 관한 법률」이 이미 규율대상으로 하고 있어 새로운 법률의 제정이 필요한 것인지 또는 기존 법률의 개정을 통하여 입법목적을 달성하도록 할 것인지에 대한 검토가 필요함.
법률안 제3조는 특정재산범죄수익 등의 환수에 있어서 법률간 경합이 발생하는 경우에는 동 법률안을 우선 적용하도록 하고 있음. 법률의 경합이 발생하는 경우는 동일한 사안에 대하여 복수의 법률이 적용되는 경우를 의미하는데 동 법률안의 환수제도는 기존의 형벌적 몰수와는 법률적 구성을 달리 하고 있어 제3조의 규정에도 불구하고 동 법률안과 타 법률안이 동시에 개별적으로 적용될 우려가 있고 그 결과 환수와 몰수가 중복적으로 이루어질 우려가 있음.",동 법률안의 환수제도는 기존의 형벌적 몰수와는 법률적 구성을 달리 하고 있어 제3조의 규정에도 불구하고 동 법률안과 타 법률안이 동시에 개별적으로 적용될 우려가 있고 그 결과 환수와 몰수가 중복적으로 이루어질 우려가 있음.
"개정안은 건당 일정 금액을 넘는 접대비의 경우 접대상대방 등 업무관련성을 입증하는 지출증빙을 보관한 경우에만 손금산입을 허용하는 이른바 “접대비 실명제”를 재도입함으로써, 기업의 불건전한 접대비 지출을 억제하여 건전한 접대문화를 조성하려는 것임.
  접대비 실명제는 2004년 처음 도입되어 운영되어 오다가 규제 완화 등을 이유로 2009년 2월 정부가 법인세법 시행령을 개정하여 폐지하였음. 운영 당시에는 건당 50만원을 넘는 접대비에 대해서 지출증빙을 보관하도록 하였고 지출증빙으로 접대목적･접대자의 부서명 및 상호･접대상대방의 상호 및 성명 등을 기재하도록 하였음.
  개정안에 대해서는 다음과 같은 반대의견이 있음.
  첫째, 접대비의 손금산입에 대해서는 현재 총량규제를 두고 있는 상황에서 실명제까지 도입하는 것은 과도한 규제가 될 수 있음. 현행 법인세법 제25조는 접대비에 대하여 일정한 한도까지만 손금산입을 허용하고 있음.
  접대비는 기업 활동에 필요한 업무관련경비로서 본래 손금성이 인정되는 항목이지만, 업무관련성을 일일이 확인하기 어렵고 과도한 접대비 지출은 불건전한 유흥문화로 이어질 수 있는 점 등을 고려하여 조세정책적으로 손금산입 한도를 두고 있는 것임.
  손금성이 인정되는 지출은 전액 손금산입하는 것이 원칙이라는 점에서, 이미 손금산입 한도가 있는 접대비에 대해 추가적인 규제를 도입하는 것은 과도한 측면이 있음. 정부가 2009년 접대비 실명제를 폐지할 때도 기업하기 좋은 환경 조성을 위해 규제를 완화하려는 취지였음.
  둘째, 접대비 실명제 도입시 영수증 등에 접대목적･상대방 성명 등 업무관련성을 기재하여 보관해야 하므로 관리비용이 증가하여 기업활동에 부담이 될 수 있음.
  또한 우리나라의 기업현실 등으로 인해 중소기업의 접대비 지출 및 매출액 대비 접대비 비율이 대기업보다 큰 상황이므로 중소기업에게 더 큰 부담이 발생할 우려가 있음.
  셋째, 실명제가 적용되는 기준금액(과거 건당 50만원) 이하로 끊어서 결제하거나 회계장부를 조작하여 접대비가 아닌 복리후생비 등 타 비용으로 처리하는 등 조세회피를 위한 편법이 증가할 수 있고, 접대비 지출 감소로 내수진작에 부정적 영향을 미칠 수 있다는 의견이 있음.
  그러나 다음과 같은 점을 고려하여 적극적으로 검토할 필요가 있음.
  첫째, 업무관련성이 없는 사적인 지출까지 접대비 명목으로 처리하여 손금에 산입하는 것은 불법적인 탈세행위로써 근절되어야 하므로 업무관련성 증명을 강화함으로써 탈세를 사전에 방지할 필요가 있음.
  실제로 사용자나 임원이 개인적 용도로 법인카드를 사용하고 이를 접대비로 처리하는 탈세행위가 적지 않게 이루어지고 있지만, 국세청이 일일이 점검하기에는 한계가 있는 실정임.
  또한 개정안은 업무관련성이 입증되지 않은 접대비만 손금산입을 제한하려는 것일 뿐 접대비 지출 자체를 제한하는 것이 아니므로, 기업의 자율적인 접대비 지출에 대한 과도한 규제로 보기 어려움.
  둘째, 향락성의 불건전한 접대문화를 개선할 필요가 있음. 최근 5년간 호화유흥업소에서의 접대비 지출현황은 연간 평균 1조 4,317억원에 달하는 것으로 나타나고 있음.
  접대비 실명제를 도입할 경우 호화유흥업소에서의 접대비 지출이 감소할 수 있으며, 유흥산업이 지하경제의 주요 업종 중 하나라는 점에서 지하경제 축소에도 기여할 수 있을 것임.
  또한 불건전한 접대비 지출을 문화접대비 등 건전하고 실속 있는 접대비 지출로 전환하도록 유도함으로써, 오히려 기업의 비용절감을 촉진하고 투명한 경영문화를 정착시키는 효과도 기대할 수 있음.
  셋째, 편법처리에 대해서는 국세청이 전산망을 통해 법인카드 사용내역을 시간대별･사용자별･업소별로 파악･분석할 수 있으므로 불성실 신고에 대한 세무조사로 대응함으로써 점차 시정될 수 있을 것임.
  또한 과도한 접대비 지출 억제로 일시적으로는 소비감소가 나타날 수도 있으나, 전체 소비에서 50만원 이상의 접대비가 차지하는 비중은 미미할 것으로 추정되므로 소비감소 효과가 있다고 보기는 어려움.
  한편, 접대비 실명제와 관련된 해외사례를 살펴보면, 미국은 75달러 이상의 접대비에 대해 접대장소･상대방 인적사항 등이 기록된 증거서류를 요구하며, 싱가포르는 사업관련성을 인정받으려면 접대한 자의 이름･사업관련 회의내용 등에 대한 기록을 유지하도록 정하고 있음.","개정안은 건당 일정 금액을 넘는 접대비는 접대상대방 등 업무관련성을 입증하는 지출증빙을 보관한 경우에만 손금산입을 허용하는 “접대비 실명제”를 재도입하여, 기업의 불건전한 접대비 지출을 막고 건전한 접대문화를 조성하려는 것인데, 이미 손금산입 한도가 있는 접대비에 추가적인 규제를 도입하는 것은 과도한 측면이 있고, 접대비 영수증 등 관리비용이 증가하여 기업활동에 부담이 될 수 있으며, 조세회피를 위한 편법이 늘어날 수 있고, 접대비 지출 감소로 내수진작에 부정적 영향을 미칠 수 있다는 반대 의견이 존재함.
그러나, 업무관련성이 없는 사적인 지출까지 접대비 명목으로 처리하여 손금에 산입하는 것은 불법적인 탈세행위이므로 이를 방지할 필요가 있고, 업무관련성이 입증되지 않은 접대비만 손금산입을 제한하려는 것이므로 과도한 규제로 보기 어렵다는 점, 접대비 실명제를 도입하면 접대비 지출이 감소하여 지하경제 축소에도 기여할 수 있고, 기업의 비용절감을 촉진하고 투명한 경영문화를 정착시키는 효과도 기대할 수 있다는 점, 편법처리에 대해서는 국세청이 전산망을 통해 법인카드 사용내역을 시간대별･사용자별･업소별로 파악･분석할 수 있으므로 불성실 신고에 대한 세무조사로 대응하여 점차 시정될 것이라는 점 등을 긍정적으로 고려해야 할 것임."
"□ 「국가재정법」 제14조제2항에서 정하고 있는 기준에 따라 기금 신설의 타당성 여부를 검토한 결과, 인문진흥기금의 설치는 기금 신설 기준에 다소 부합하지 않는 것으로 보임. 또한, 일반회계 등의 인문학 진흥 사업과 관련된 예산규모를 확대할 경우 별도의 기금 설치 없이도 개정안의 입법취지를 대부분 달성할 수 있는 만큼, 기금 신설에 앞서 이에 대한 정책적 판단이 선행될 필요가 있다고 봄. 
□ 한편, 개정안은 신계륜의원이 대표발의한 「인문학 진흥 및 인문강좌등의 지원에 관한 법률안」에 대한 소관 상임위원회(교육문화체육관광위원회)의 의결을 전제로 하는 것이므로 해당 위원회의 심사과정을 감안하여 심의할 필요가 있음.","국가재정법에서 정하고 있는 기준에 따라 기금 신설의 타당성 여부를 검토한 결과, 인문진흥기금의 설치는 신설 기준에 다소 부합하지 않는 것으로 보이며, 인문학 진흥 사업과 관련된 예산규모를 확대할 경우 별도의 기금 설치 없이도 개정안의 입법취지를 대부분 달성할 수 있는 만큼, 이에 대한 정책적 판단이 선행될 필요가 있다고 봄."
"1. 상임위원장 배분 규정(안 제41조제2항)
 ◦ 현행 국회법상 의장․부의장 선거는 국회의원 총선거 후 최초 집회일(6월5일)에 실시하고, 상임위원장 선거는 최초 집회일부터 3일(6월 8일)이내에 실시하며(§15②, 41③), 상임위원회 위원장 배분에 대해서는 규정이 없음.
 ◦ 개정안은 상임위원회 위원장(예결특위 및 윤리특위 위원장 포함)에 대한 교섭단체별 배분과 위원장 선택에 관한 사항을 규정하려는 것임.
   - 개정안은 상임위원장을 교섭단체 소속의원 수의 비율에 따라 각 교섭단체에 배분하고, 교섭단체 소속의원 수가 많은 교섭단체부터 배분된 수의 상임위원장을 먼저 선택하도록 하려는 것임.
   - 이 경우 각 교섭단체에 배분되는 상임위원장 수는 교섭단체 소속의원 수 비율에  전체 위원장 수를 곱하여 나온 정수(整數)의 의석을 먼저 배분하고, 잔여의석은 소수점이하가 큰 순으로 각 교섭단체에 1석씩 배분하여 정하려는 것임.
◦ 이는 국회의 원구성과 관련하여 상임위원장 수 배분 및 위원장 선택 등에 대한 교섭단체 간 협상이 원만하지 않을 경우 원구성이 지연되는 사례가 있으므로 이를 방지하고, 상임위원장 배분 및 선택을 법적으로 제도화하려는 취지라고 할 수 있음.
 ◦ 이와 같이 상임위원장 배분이나 선택을 법정화 하게 되면, 상임위원장 배분 및 선택 문제로 인한 원구성 지연은 어느 정도 해결할 수 있다는 측면에서 의의가 있음.
 ◦ 다만, 개정안과 같이 규정할 경우, 위원장 선출 기한(6월 8일) 이전에 위원장이 자동 배분․선택되게 되어 교섭단체 간 상임위원장 배분과 관련된 협상의 여지를 제한하게 될 우려가 있음.
   - 위원장 자동 배분․선택의 법정화는 개원협상이 원만하지 않아 법정 선출일(6월 8일 이전)에 위원장을 정상적으로 선출하지 못하고, 일정 기한이 초과된 경우에 적용하는 방안도 검토할 필요가 있을 것임.
  ◦ 또한, 상임위원장 배분과 관련하여 정수 아래의 소숫점이 교섭단체 간에 동일하게 산출되는 경우, 이에 대한 배분방안에 대하여도 보완이 필요할 것임.","현행 국회법상 의장․부의장 선거는 국회의원 총선거 후 최초 집회일(6월5일)에 실시하고, 상임위원장 선거는 최초 집회일부터 3일(6월 8일)이내에 실시하며, 상임위원회 위원장 배분에 대해서는 규정이 없음. 개정안은 상임위원회 위원장(예결특위 및 윤리특위 위원장 포함)에 대한 교섭단체별 배분과 위원장 선택에 관한 사항을 규정하려는 것임. 개정안은 상임위원장을 교섭단체 소속의원 수의 비율에 따라 각 교섭단체에 배분하고, 교섭단체 소속의원 수가 많은 교섭단체부터 배분된 수의 상임위원장을 먼저 선택하도록 하려는 것임. 이 경우 각 교섭단체에 배분되는 상임위원장 수는 교섭단체 소속의원 수 비율에 전체 위원장 수를 곱하여 나온 정수의 의석을 먼저 배분하고, 잔여의석은 소수점이하가 큰 순으로 각 교섭단체에 1석씩 배분하여 정하려는 것임. 이는 국회의 원구성과 관련하여 상임위원장 수 배분 및 위원장 선택 등에 대한 교섭단체 간 협상이 원만하지 않을 경우 원구성이 지연되는 사례가 있으므로 이를 방지하고, 상임위원장 배분 및 선택을 법적으로 제도화하려는 취지라고 할 수 있음. 이와 같이 상임위원장 배분이나 선택을 법정화 하게 되면, 상임위원장 배분 및 선택 문제로 인한 원구성 지연은 어느 정도 해결할 수 있다는 측면에서 의의가 있음. 위원장 자동 배분․선택의 법정화는 개원협상이 원만하지 않아 법정 선출일(6월 8일 이전)에 위원장을 정상적으로 선출하지 못하고, 일정 기한이 초과된 경우에 적용하는 방안도 검토할 필요가 있을 것임."
"가. 개정안의 주요내용
  개정안은 출생신고시 의사나 조산사의 출생증명서를 첨부할 수 없는 경우에는 가정법원의 확인을 받고 그 확인서를 받은 날부터 1개월 이내에 출생신고를 하도록 출생신고 절차를 강화하려는 것임. 
  현재 출생신고는 의사ㆍ조산사가 작성한 출생증명서를 제출하거나, 그 밖에 분만에 관여한 사람 또는 출생사실을 아는 사람의 인우보증을 통하여 신고가 가능하도록 하고 있음. 
  개정안은 인우보증 제도를 악용하여 전과자의 신분세탁이나 외국인의 불법국적 취득이 빈번하게 발생하고 있다는 지적에 따라 인우보증 제도를 폐지하고 명확히 출생사실이 확인되지 않는 경우에는 가정법원의 확인을 거쳐 출생신고를 하도록 함. 
  나. 개정안에 대한 검토
  현행법은 의사ㆍ조산사가 작성한 출생증명서를 제출하거나, 그 밖에 분만에 관여한 사람 또는 출생사실을 아는 사람의 인우보증을 통하여 출생의 신고가 가능하도록 하고 있음. 그런데 인우보증에 의한 출생신고의 경우에는 신분관계 등록 담당공무원에게는 형식적 심사권만 있어 보증의 진실성이나 서류가 위조되지 않았다는 사실을 확인할 수 없음. 이로 인하여 인우보증에 의한 출생신고를 악용하여 전과자 신분 세탁이나 불법 국적취득 등의 부작용이 속출하고 있는 실정임. 
  이에 인우보증제를 폐지하고 출생사실을 증명할 수 없는 경우에는 가정법원의 출생확인을 받아 출생신고를 할 수 있도록 하는 개정안은 적절한 개정이라 판단됨. 
  다만, 인우보증제를 폐지함에 있어서 ‘그 밖에 분만에 관여한 자’를 삭제할 경우에는 병원에서 출산을 하지 못한 국민의 출생신고를 원천적으로 봉쇄하는 결과를 초래하여, 경제적 약자, 미혼모의 출생신고에 심각한 제약을 초래할 수 있다는 문제가 제기될 소지가 있음. 이에 법률로 정하는 일정한 서면을 첨부하는 경우에는 가정법원의 확인절차를 거치지 아니하고 출생신고를 할 수 있도록 하는 방안을 마련해둘 필요가 있음.","현행법은 의사ㆍ조산사가 작성한 출생증명서를 제출하거나 그 밖에 분만에 관여한 사람 또는 출생사실을 아는 사람의 인우보증을 통하여 출생의 신고가 가능하도록 하고 있는데, 이 경우 신분관계 등록 담당공무원에게는 형식적 심사권만 있어 보증의 진실성이나 서류가 위조되지 않았다는 사실을 확인할 수 없어 전과자 신분 세탁이나 불법 국적취득 등의 부작용이 속출하고 있는 실정임.
이에 개정안은 인우보증제를 폐지하고 출생사실을 증명할 수 없는 경우에는 가정법원의 출생확인을 받아 출생신고를 할 수 있도록 하려는 것인데, 인우보증제를 폐지함에 있어서 ‘그 밖에 분만에 관여한 자’를 삭제할 경우에는 병원에서 출산하지 못한 국민의 출생신고를 원천적으로 봉쇄하는 결과를 초래하여 경제적 약자 등의 출생신고에 심각한 제약을 초래할 수 있다는 문제가 제기될 소지가 있으므로, 이에 법률로 정하는 일정한 서면을 첨부하는 경우에는 가정법원의 확인절차를 거치지 아니하고 출생신고를 할 수 있도록 하는 방안을 마련해야 하겠음."
"현행 제22조(과징금)에 따르면, 담합에 대한 과징금은 관련 매출액의 10% 이내, 매출액이 없을 경우 정액 과징금 20억원 이내에서 부과하도록 하고 있음. 
    그런데, 이같은 기준에 따라 부과되는 과징금이 담합으로 인해 얻는 이익보다 적어 실효성 있는 행정제재가 이루어지지 않고 있다는 지적이 일각에서 제기되어 왔음. 
    이에 개정안은 담합에 대한 과징금 부과기준을 관련 매출액의 20% 이내, 매출액이 없을 경우 정액 과징금 30억원 이내로 각각 상향조정하려는 것임.  
    연혁적으로 볼 때, 담합에 대한 과징금 부과기준은 시대에 따른 경제규모 및 상황에 따라 꾸준히 상향해 왔으며, 외국 역시 각국의 경제규모 및 상황에 따라 과징금(벌금) 상한이 각각 다름. 
    또한, 현행 부과수준을 두고서도 사업자들은 구체적 사정을 고려하지 않아 과중하다고 주장(‘과징금 폭탄’)하는 반면, 일반 소비자들은 과소하다고 주장(‘솜방망이 처벌’)하는 등 상반된 평가가 병존하고 있음. 
    따라서, 과징금 부과기준을 상향할지 여부는 법 억제 효과와 기업의 부담 측면 등을 충분히 비교 형량한 정책적 판단을 요하는 사안으로 생각됨.  
    다만, 동 개정안 외에 현재 국회정무위원회에 과징금 부과기준 변경과 관련하여, 노회찬의원 대표발의안(2012.9.12.) 및 김기식의원 대표발의안(2013.2.21.)이 각각 계류 및 회부되어 있으므로, 동 관련 개정안들은 병합 검토될 필요가 있음.  
    아울러, 공정거래질서 확립을 위해 개정안과 같은 과징금 부과기준 상향이라는 행정제재 수준을 높이는 방안과 함께, 전속고발권 제도(형사제재), 집단소송 및 징벌적 손해배상제도(민사제재) 관련 법안도 함께 논의 중이므로, 공정거래 전반에 걸친 적정한 수준의 제재가 종합적인 시각에서 검토될 필요가 있을 것으로 봄.","현행 제22조에 따르면, 담합에 대한 과징금은 관련 매출액의 10% 이내, 매출액이 없을 시 정액 과징금 20억원 이내에서 부과하도록 하나, 이같은 기준에 따라 부과되는 과징금이 담합으로 인해 얻는 이익보다 적어 행정제재가 실효성이 없다는 비판이 존재하며, 이에 개정안은 담합에 대한 과징금 부과기준을 관련 매출액의 20% 이내, 매출액이 없을 시 정액 과징금 30억원 이내로 각각 상향하려는 내용임.
또한, 현행 부과수준을 두고서도 사업자들은 구체적 사정을 고려하지 않아 과중하다고 주장하는 반면, 일반 소비자들은 과소하다고 주장하는 등 상반된 평가가 존재하므로, 과징금 부과기준을 상향할지 여부는 법 억제 효과와 기업의 부담 측면 등을 충분히 비교 형량한 정책적 결정을 해야 하나, 동 개정안 외에 현재 국회정무위원회에 과징금 부과기준 변경과 관련해, 노회찬의원 대표발의안 및 김기식의원 대표발의안이 각각 계류 및 회부되어 있으므로, 동 관련 개정안들은 병합 검토돼야 함.
아울러, 공정거래질서 확립을 위해 개정안과 같은 과징금 부과기준 상향이라는 행정제재 수준을 높이는 방안과 함께, 전속고발권 제도, 집단소송 및 징벌적 손해배상제도 관련 법안도 함께 논의 중이므로, 공정거래 전반에 걸친 적정한 수준의 제재에 대한 종합적인 검토가 필요함."
