paragraph,gen_summary
"가. 중장기재무관리계획 변경 요구
□ 개정안은 기관의 경영환경이나 경제여건 및 국가정책방향  등에 따라 기획재정부장관과 주무기관의 장이 중장기재무관리계획의 변경을 요구할 수 있도록 함(안 제39조의2 신설).
□ 중장기재무관리계획을 제출하도록 하는 것은 공공기관의 부채수준 등 재무건전성을 점검해 보고 미래의 재정 부담으로 연계되지 않도록 지속적으로 모니터링하기 위한 것이므로, 기관의 수익구조 변경이나 부채 증감 등 경영환경을 고려하여 계획 변경이 요구될 수 있을 것으로 보여짐.
   또한, 중장기재무관리계획은 5년 단위로 수립․제출되는 것이므로 그 기간 동안 발생할 수 있는 국내외적인 경제 여건의 변동이나 정책기조의 변화 등을 반영해야 할 경우도 있을 것임.
   따라서, 공기업과 준정부기관을 관리하는 기획재정부 장관과 주무기관의 장이 상황에 따라 중장기채무관리계획의 변경을 요구할 수 있도록 규정하는 것은 필요성이 인정되는 입법이라고 생각됨.
□ 다만, 「공공기관의 운영에 관한 법률」의 목적이 공공기관의 자율경영 및 책임경영체제의 확립에 있다는 점과, 공공기관 중장기재무관리계획은 공공기관 스스로 수립·작성하여 강도 높은 자구노력을 통해 재무건전성을 유지할 수 있도록 하는데 제도의 취지가 있다는 점을 고려하면, 기획재정부나 주무기관의 관여가 공공기관의 독립성 및 자율성을 훼손하는 결과로 나타나는 것을 막을 수 있는 제도적 장치에 대한 검토가 필요하다고 사료됨. 
  
□ 또한, 중장기 경영목표는 아무런 제약 없이 기획재정부 장관과 주무기관의 장이 변경을 요구할 수 있도록 규정되어 있으나, 중장기 경영목표와 달리 중장기재무관리계획의 경우에는 국가 재정과 밀접한 관련이 있고, 그러한 이유로 「국가재정법」에서 국회에의 제출의무를 규정하고 있으므로, 중장기재무관리계획변경의 요구 또한 국가재정에 관련된 사항으로서 국회의 통제를 받아야 할 필요가 있음.
   
□ 따라서, 기획재정부 장관과 주무기관의 장이 계획의 변경을 요구할 수 있도록 하는 개정안에 대해서는, 국회 상임위원회에 보고를 거치도록 하는 등 변경요구권의 남용을 방지하는 방안에 대한 검토가 수반되어야 할 것으로 사료됨. 
 나. 중장기재무관리계획 이행 보고서 제출 및 경영평가 반영 
□ 개정안은 중장기재무관리계획을 수립하는 기관으로 하여금 중장기재무관리계획의 이행에 관한 보고서를 작성하여 제출하도록 하고(안 제47조제1항), 동 보고서를 경영실적 평가의 기초가 되는 자료에 추가함(안 제48조제1항 및 제4항).
□ 현행법은 공공기관의 부채를 철저하게 관리하고 재무건전성을 제고하기 위하여 중장기재무관리계획을 수립, 제출하는 제도를 도입하였으나, 중장기재무관리계획을 이행하지 않는 경우에 대한 제재장치가 없어 중장기재무관리계획과 달리 과도하게 투자 사업을 확대하여 재무건전성이 더욱 악화되는 경우에도 특별히 불이익을 줄 수 없는 상황임.
   이에 중장기재무관리계획 이행 여부를 경영실적 평가에 반영하도록 함으로써 중장기재무관리계획의 이행에 보다 강제성을 부여하고자 하는 개정안의 취지는 현 제도의 실효성을 확보한다는 차원에서 타당성이 인정된다고 보여짐. 
□ 다만, 중장기재무관리계획은 기획재정부, 주무기관의 장뿐만 아니라 국회에까지 제출되는 공식적인 것이고, 계획의 이행여부는 기관의 재무 상태에 관한 지표를 통하여 어렵지 않게 파악할 수 있으므로, 별도로 계획의 이행에 대한 보고서를 작성하여 제출하도록 하는 것은 공공기관의 부담을 가중하는 규제가 될 가능성이 있음.
   중장기재무관리계획의 이행에 대한 보고서 제출이 반드시 필요한지에 대해서는 중장기재무관리계획 제출 제도가 2012년부터 시작되어 초기 단계라는 점을 감안할 때, 제도의 운영 과정을 지켜보며 신중하게 판단할 필요가 있을 것으로 생각됨.
□ 한편, 경영실적 평가와 관련하여 현행법은 주무기관의 장이 기관장으로 임명되는 사람과 체결한 계약의 이행에 관한 보고서와 기관장이 기획재정부 장관과 주무기관의 장에게 제출한 경영목표에 관한 보고서를 기초로 하여 공기업․준정부기관의 경영실적을 평가하도록 규정하고 있음.
   기획재정부는 이에 따라 매년 경영실적 평가 편람을 확정하고, 리더십, 책임경영, 조직 및 인적자원 관리, 주요사업 중 계획․활동, 국민평가, 주요사업 중 성과, 업무효율, 재무예산 관리 및 성과, 보수 및 성과관리, 사회적 기여 등의 항목에 대하여 평가하고 있음. 
   기획재정부가 2012년 12월 17일, 제12차 공공기관운영위원회 심의·의결을 거쳐 확정한「2013년도 공공기관 경영평가편람」에는 중장기재무관리계획을 국회에 제출한 41개 기관 중 33개 기관에 대하여 재무건전성 제고 이행실적을 평가하는 내용이 포함되어 있음.
□ 이처럼 중장기재무관리계획의 이행 여부는 경영실적 평가의 항목으로 편입되는 것이 평가편람에 계획되어 있지만, 대형 공공기관의 부채관리와 재무건전성 제고가 가지는 중요성에 비추어 보면, 계획 이행 여부의 평가 반영을 법률로 규정하는 것이 타당하다고 사료됨. 
□ 따라서, 중장기재무관리계획 이행 여부를 경영실적 평가에 반영하고자 하는 개정안의 입법취지를 고려하여, 경영실적 평가의 항목을 법률에 규정하고, 중장기재무관리계획 이행 여부를 평가항목에 포함시키는 방식의 입법을 검토해 볼 필요가 있을 것으로 생각됨.","개정안은 기관의 경영환경이나 경제여건 및 국가정책방향 등에 따라 기획재정부장관과 주무기관의 장이 중장기재무관리계획의 변경을 요구할 수 있도록 함. 「공공기관의 운영에 관한 법률」의 목적이 공공기관의 자율경영 및 책임경영체제의 확립에 있다는 점과, 공공기관 중장기재무관리계획은 공공기관 스스로 수립·작성하여 강도 높은 자구노력을 통해 재무건전성을 유지할 수 있도록 하는데 제도의 취지가 있다는 점을 고려하면, 기획재정부나 주무기관의 관여가 공공기관의 독립성 및 자율성을 훼손하는 결과로 나타나는 것을 막을 수 있는 제도적 장치에 대한 검토가 필요하다고 사료됨. 중장기 경영목표와 달리 중장기재무관리계획의 경우에는 국가 재정과 밀접한 관련이 있고, 그러한 이유로 「국가재정법」에서 국회에의 제출의무를 규정하고 있으므로, 중장기재무관리계획변경의 요구 또한 국가재정에 관련된 사항으로서 국회의 통제를 받아야 할 필요가 있음. 개정안은 중장기재무관리계획을 수립하는 기관으로 하여금 중장기재무관리계획의 이행에 관한 보고서를 작성하여 제출하도록 하고, 동 보고서를 경영실적 평가의 기초가 되는 자료에 추가함. 중장기재무관리계획은 기획재정부, 주무기관의 장뿐만 아니라 국회에까지 제출되는 공식적인 것이고, 계획의 이행여부는 기관의 재무 상태에 관한 지표를 통하여 어렵지 않게 파악할 수 있으므로, 별도로 계획의 이행에 대한 보고서를 작성하여 제출하도록 하는 것은 공공기관의 부담을 가중하는 규제가 될 가능성이 있음. 중장기재무관리계획의 이행 여부는 경영실적 평가의 항목으로 편입되는 것이 평가편람에 계획되어 있지만, 대형 공공기관의 부채관리와 재무건전성 제고가 가지는 중요성에 비추어 보면, 계획 이행 여부의 평가 반영을 법률로 규정하는 것이 타당하다고 사료됨. 중장기재무관리계획 이행 여부를 경영실적 평가에 반영하고자 하는 개정안의 입법취지를 고려하여, 경영실적 평가의 항목을 법률에 규정하고, 중장기재무관리계획 이행 여부를 평가항목에 포함시키는 방식의 입법을 검토해 볼 필요가 있을 것으로 생각됨."
"□ 개정안은 기획재정부장관이 성인지 예산서 및 기금운용계획에 대한 평가를 실시하고 그 결과를 재정운용에 반영할 수 있도록 하는 한편, 성인지 예산서의 작성 및 평가와 관련하여 관계 전문기관 등에 조사ㆍ연구 등을 위탁할 수 있도록 하고자 함
□ 2010년 예산에서 처음 도입된 성인지 예산서의 대상사업은 2010년 195개, 2011년 245개, 2012년 254개로 확대되었고 대상금액도 증가하고 있음.
   그러나, 성인지 예산서 및 기금운용계획은 사업대상자 및 사업수혜자 선정이나 통계가 부적절하거나 성과목표 및 성평등 목표가 부적절하게 설정하는 등 여전히 미흡한 것으로 보임
   이에 따라 관계 전문기관을 조사･연구를 바탕으로 예산서를 작성･평가하도록 하는 한편, 그 결과를 재정운용에 반영함으로써 성인지 예산제도의 실효성을 제고하려는 개정안의 입법취지는 타당하다고 여겨짐
   현재 제도적으로 성인지 예산서에 대한 평가가 실시되고 있지 않기 때문에 법률에 별도로 성인지 예산서에 대한 평가를 실시할 수 있도록 규정하는 것은 의미가 있다고 보임.
□ 그러나 현행법체계 내에서도 ‘일반적인 재정사업의 평가’규정에 따라 성인지 예산서에 대한 평가가 가능하다고 볼 수 있고 기획재정부가 국가재정법 제32조및 제68조의2에 따른 예산안이나 제57조에 따른 결산서를 작성할 때 성인지 예산서(결산서)의 총괄보고서를 작성함으로써 개정안의 취지를 달성할 수 있기 때문에, 성인지 예산제도의 실효성을 제고하기 위하여 법적 정비보다 제도운영에 내실을 기할 필요성이 더 크다고 보임
   한편, 2010년 제289회 제1차 기획재정소위원회에서 이정희 의원이 제출한 개정안에 예산서에 대한 종합분석보고서를 작성하도록 하는 사항이 포함되어 있었으나 성인지 예산제도의 성숙도가 낮은 상황을 고려하여 차후 논의하기로 한 바 있음.
.","성인지 예산서의 대상사업은 점점 확대되고 있고 대상금액도 증가하고 있으나 성인지 예산서 및 기금운용계획은 여전히 미흡한 것으로 보이므로, 개정안은 기획재정부장관이 성인지 예산서 및 기금운용계획에 대한 평가를 실시하고 그 결과를 재정운용에 반영할 수 있도록 하는 한편 성인지 예산서의 작성 및 평가와 관련하여 관계 전문기관 등에 조사ㆍ연구 등을 위탁할 수 있도록 하려는 것으로, 이를 통해 성인지 예산제도의 실효성을 제고하려는 입법취지는 타당하다고 여겨짐.
현재 제도적으로 성인지 예산서에 대한 평가가 실시되고 있지 않기 때문에 법률에 별도로 성인지 예산서에 대한 평가를 실시할 수 있도록 규정하는 것은 의미가 있겠으나, 현행법체계 내에서도 성인지 예산서에 대한 평가가 가능하다고 볼 수 있고, 기획재정부가 예산안이나 결산서를 작성할 때 성인지 예산서 및 결산서의 총괄보고서를 작성함으로써 개정안의 취지를 달성할 수 있기 때문에, 성인지 예산제도의 실효성을 제고하기 위하여 제도운영에 내실을 기할 필요성이 더 크다고 보임."
"□ 개정안은 국가‧지방자치단체‧지방자치단체조합‧대통령령으로 정하는 단체가 동물보호법에 따라 제공하는 유실‧유기동물에 대한 구조‧보호조치와 진료 용역에 대하여 부가가치세를 면제하는 내용임. 현행 부가가치세법 제26조와 동법 시행령 제35조에서는 가축‧장애인 보조견, 질병 예방을 목적으로 하는 동물의 진료용역 등에 대하여만 부가가치세를 면제하고 있어, 유실‧유기동물에 대한 진료 용역 등에 대해서는 부가가치세가 과세되고 있음.
□ 현행 동물보호법에서는 시‧도지사가 동물보호센터를 직접 설치‧운영하거나 지정하여 동물의 구조‧보호 조치를 하게 할 수 있으며, 이에 소요되는 비용을 부담할 수 있도록 하고 있음.
   그런데 현재 지방자치단체의 위탁을 받은 동물보호센터가 지방자치단체에 공급하는 유기동물에 대한 진료 용역 등에 대하여 부가가치세가 부과되고 있는 상황이므로, 
   개정안은 이에 대한 부가가치세를 면제하여 유실‧유기동물에 대한 지방자치단체의 보호 사업을 지원하는 한편, 지방자치단체의 예산이 부가가치세로 인하여 국세로 이전되는 상황을 방지하기 위한 취지인 것으로 이해됨.
□ 다만, 지방자치단체가 유기동물에 대한 진료 용역 등을 제공받으면서 부가가치세를 부담하는 것은 지방자치단체가 그 예산으로 일반적인 물품 등을 구매하거나 용역을 제공받으면서 부가가치세를 부담하는 상황과 크게 다르지 않다는 점도 감안하여 검토될 필요가 있음.","개정안은 국가‧지방자치단체‧지방자치단체조합‧대통령령으로 정하는 단체가 동물보호법에 따라 시행하는 유실‧유기동물에 대한 구조‧보호조치와 진료 용역에 대하여 부가가치세를 면제하는 것임.
현재 지방자치단체의 위탁을 받은 동물보호센터가 지방자치단체에 공급하는 유기동물에 대한 진료 용역 등에 대하여 부가가치세가 부과되고 있으므로, 개정안은 이에 대한 부가가치세를 면제하여 유실‧유기동물에 대한 지방자치단체의 보호 사업을 지원하고, 지방자치단체의 예산이 부가가치세로 통해 국세로 이전되는 것을 막기 위한 취지로 보임.
다만, 지방자치단체가 유기동물에 대한 진료 용역 등을 제공 받으면서 부가가치세를 부담하는 것은 그 예산으로 일반적인 물품 등을 구매하거나 용역을 제공 받으면서 부가가치세를 부담하는 것과 대폭 다르지 않다는 점도 고려하여 검토해야 할 것으로 보임."
"□ 개정안은 성폭력범죄자에 대한 치료프로그램에 왜곡된 성가치관을 교정하기 위한 교육프로그램을 도입하고, 교육프로그램에 정신의학과 전문의 등 전문가를 참여시키려는 것으로 입법취지는 공감할 수 있으나 다음 사항을 감안하여 신중한 검토가 필요하다고 판단됨.
   첫째, 구체적인 교육프로그램을 법정화하는 것이 바람직한가에 대한 검토가 필요함. 
   구체적인 교육프로그램을 법률로 규정하는 것은 교육프로그램의 경직성을 가져오게 될 것이고, 치료감호 대상자 중 성폭력범죄자에 대하여만 교육프로그램을 법정화하는 문제가 있음.
   둘째, 현재 치료감호소는 인지행동 치료프로그램을 개발하여 정신성적 장애자뿐만 아니라 심심장애 성폭력자에게도 확대하여 전문적으로 교육을 실시하고 있음.
   셋째, 현재 성폭력범죄자 교육프로그램에 정신의학과 전문의 외에 임상심리사, 사회사업가 등 다양한 전문가를 참여시켜 교육을 실시하고 있음.
□ 결론적으로 입법취지를 달성하기 위한 방법으로 교육프로그램을 법정화하기보다는 임상심리사와 의료진 등 치료감호소의 인력과 예산을 지원하여 내실있는 교육이 이루어질 수 있도록 하는 것이 보다 적절할 것으로 판단됨.","개정안은 성폭력범죄자에 대한 치료프로그램에 왜곡된 성가치관을 교정하기 위한 교육프로그램을 도입하고, 교육프로그램에 참여시키려는 내용으로, 취지는 공감할 수 있으나 다음 사항을 고려하여 신중한 검토가 필요함.
첫째, 구체적인 교육프로그램을 법률로 규정하는 것은 교육프로그램의 경직성을 가져오게 될 것이고, 성폭력범죄자에 대하여만 교육프로그램을 법정화하는 문제가 있음.
둘째, 현재 치료감호소는 인지행동 치료프로그램을 개발하여 정신성적 장애인뿐 아니라 심신장애 성폭력자에게도 전문적으로 교육을 하고 있음.
셋째, 현재 성폭력범 교육프로그램에 다양한 전문가들이 참여하고 있음.
결론적으로 입법 취지를 달성하기 위해 교육프로그램을 법정화하기보다는 임상심리사와 의료진 등 치료감호소의 인력과 예산을 지원하여 내실 있는 교육이 이루어지도록 하는 것이 더 적절할 것으로 판단됨."
"현행법은 법인의 소득종류를 구분하지 않고 전체 이익에 대하여 누진세율을 적용하여 법인세를 과세하고 있으나, 개정안은 법인의 이자‧배당소득 등 특정한 종류의 소득에 대하여 현행 법인세율보다 높은 38%의 세율로 분리과세하려는 것임.
개정안의 취지는 기업의 금융‧부동산 소득 등에 대한 과세를 강화함으로써, 기업이 저축이나 부동산 투자보다는 실물투자와 고용을 늘리도록 유도하려는 것임.
이에 개정안은 기업의 금융소득 등에 대한 법인세 과세를 강화하여 기업저축에 대한 세후수익률을 낮추고 기업저축에 대한 유인을 축소시킴으로써, 기업이 저축보다 실물투자 및 고용을 확대하도록 유도하려는 것임.
참고로, 금융회사를 제외한 법인의 이자‧배당‧임대료 수익의 합계가 2014년 신고기준으로 30조 7,814억원에 이르고 있어, 이에 대하여 고율의 분리과세를 하게 되면 상당한 세부담 증가 효과가 발생할 것으로 전망됨.
다만, 법인의 금융소득 등에 대하여 고율로 분리과세하려는 개정안의 경우 현행 법인세 과세체계와의 중복성‧정합성과 고율 분리과세의 효과성 등을 종합적으로 고려하여 검토할 필요가 있음.
현행법에서도 법인의 과도한 사내유보 및 부동산 투자를 방지하기 위한 각종 제도를 이미 두고 있어, 개정안과 중복과세 우려가 있음.
우선 법인의 이익을 투자, 임금, 배당 등으로 환류하지 않고 과도하게 사내에 유보할 경우 미환류소득에 대하여 10%의 법인세를 추가과세하게 됨(「법인세법」 제56조). 또한, 법인이 업무에 직접 사용하지 않는 부동산을 취득․관리함으로써 생기는 비용 및 관련 이자비용을 손금에 불산입하고 있으며(「법인세법」 제27조, 제28조), 비사업용 토지 등의 양도소득에 대해 10%의 세율로 추가과세하고 있음(법인세법 제55조의2).
그리고 금융소득 등에 대해서만 다른 세율을 적용하는 것은 소득종류의 구분 없이 법인의 전체 소득에 대하여 과세되는 현행 법인세 체계의 정합성 측면에서 문제가 있을 수 있음.","개정안은  기업저축에 대한 세후수익률을 낮추고 기업저축에 대한 유인을 축소시킴으로써, 기업이 저축보다 실물투자 및 고용을 확대하도록 유도하려는 것이나, 현행 법인세 과세체계와의 중복성‧정합성과 고율 분리과세의 효과성 등을 종합적으로 고려하여 검토할 필요가 있음."
"개정안은 중소기업간 하도급 거래에 있어 원사업자의 지위를 갖는 중소기업의 범위를 종전 “연간매출액이나 상시고용 종업원 수 중 어느 하나라도 많은 중소기업자”에서 “연간매출액이 많은 중소기업자”로 변경하여 상시고용 종업원 수 기준을 제외하고 있음.
현행법에 따르면 매출액이 작은 중소기업자라도 상시고용 종업원 수가 많다면 매출액이 큰 업체를 상대로 원사업자로서의 의무를 부담할 수 있게 되어 거래 현실과 맞지 않는 측면이 발생할 수 있음.
실제 과거와 달리 소규모 인력만으로도 우월한 지위를 갖는 회사나, 대규모 인력에도 종속적 지위를 갖는 회사들이 발생하고 있고, 중소기업으로 보기 어려운 성장 기업임에도 계속적으로 중소기업 정책 지원대상이 되기 위하여 근로자 수를 전략적으로 기준 이하로 유지시키는 등 소위 “피터팬 증후군”현상과 같은 부작용이 나타나고 있으며, 매출액은 제품의 판매규모로 하도급거래에서 발주역량을 보여준다는 점에서 기업 간 거래에 있어 중요한 요소라는 점 등을 고려할 때 원사업자와 수급사업자를 판단함에 있어 연간매출액 기준만을 적용하는 것은 거래 현실을 고려할 때 타당성이 있음.
또한, 2015년 2월 3일부터 시행중인 개정 「중소기업기본법」에서도 중소기업자의 범위를 정함에 있어 “상시 근로자 수”기준을 제외하고 있다는 점을 감안할 때 법률 체계에도 부합한 것으로 보임.","개정안은 중소기업간 하도급 거래에 있어 원사업자의 지위를 갖는 중소기업의 범위를 종전 “연간매출액이나 상시고용 종업원 수 중 어느 하나라도 많은 중소기업자”에서 “연간매출액이 많은 중소기업자”로 변경하여 상시고용 종업원 수 기준을 제외하고 있음. 중소기업으로 보기 어려운 성장 기업임에도 계속적으로 중소기업 정책 지원대상이 되기 위하여 근로자 수를 전략적으로 기준 이하로 유지시키는 등 소위 “피터팬 증후군”현상과 같은 부작용이 나타나고 있으며, 매출액은 제품의 판매규모로 하도급거래에서 발주역량을 보여준다는 점에서 기업 간 거래에 있어 중요한 요소라는 점 등을 고려할 때 원사업자와 수급사업자를 판단함에 있어 연간매출액 기준만을 적용하는 것은 거래 현실을 고려할 때 타당성이 있음."
